{
  "schema_version": "1.1.0",
  "task_id": "TSK-B3BC452716",
  "display_key": "IDENTITY-REFRESH-002",
  "project_id": "example-product",
  "plan_version": "1.0.0",
  "parent_task_id": "TSK-4B11FC1A65",
  "ancestor_ids": [
    "TSK-4B11FC1A65"
  ],
  "supersedes": [],
  "replaced_by": [],
  "superseded_by": [],
  "title": "Reject refresh-token reuse and revoke the affected token family",
  "objective": "Implement refresh-token reuse detection so a replayed token invalidates its full token family and returns the documented authentication error.",
  "rationale": "Token rotation without reuse detection allows a stolen refresh token to remain useful after the legitimate client rotates it.",
  "level": "LEAF",
  "dispatchable": true,
  "category": "SECURITY",
  "subtype": "authentication",
  "hierarchy_path": [
    "Identity",
    "Session management",
    "Refresh-token rotation"
  ],
  "workstream_id": "WS-IDENTITY",
  "workstream": "Identity",
  "epic": "Session management",
  "feature": "Refresh-token rotation",
  "component_ids": [
    "CMP-AUTH-API",
    "CMP-TOKEN-STORE"
  ],
  "requirement_ids": [
    "REQ-AUTH-017",
    "REQ-SEC-004"
  ],
  "source_refs": [
    "SRC-PRD-0087",
    "DERIVED-SECURITY"
  ],
  "derived_concern_refs": [
    "DERIVED-SECURITY"
  ],
  "derived_concern_reason": "Refresh-token rotation requires replay protection to meet the stated account-security objective.",
  "status": "READY",
  "priority": "P0",
  "risk": "HIGH",
  "size": "M",
  "complexity": "HIGH",
  "technology_stack": [
    "TypeScript",
    "PostgreSQL"
  ],
  "preconditions": [
    "The refresh-token family schema and rotation contract are approved."
  ],
  "inputs": [
    "Refresh-token contract",
    "Token-family persistence interface"
  ],
  "expected_outputs": [
    "Reuse-detection domain behavior",
    "Family-revocation persistence operation",
    "Automated tests"
  ],
  "expected_artifacts": [
    "auth service changes",
    "unit/integration tests"
  ],
  "in_scope": [
    "Detect a previously consumed refresh token",
    "Revoke all active tokens in the family",
    "Return the standard invalid-session response"
  ],
  "out_of_scope": [
    "Changing access-token lifetime",
    "User-facing security notification"
  ],
  "read_scope": [
    "logical:identity/session-management"
  ],
  "write_scope": [
    "logical:auth-api",
    "logical:token-store"
  ],
  "requires_repo_binding": true,
  "hard_dependencies": [
    "TSK-6FF57FCE58"
  ],
  "soft_dependencies": [],
  "blocking_decision_ids": [],
  "acceptance_criteria": [
    {
      "criterion_id": "AC-1",
      "statement": "Reusing a consumed refresh token revokes every active token in the same family.",
      "verification_type": "TEST",
      "verification_detail": "Integration test with two rotations followed by replay of the first token.",
      "requirement_ids": [
        "REQ-AUTH-017",
        "REQ-SEC-004"
      ],
      "mandatory": true,
      "evidence_expected": "test log"
    },
    {
      "criterion_id": "AC-2",
      "statement": "The replay request returns the documented invalid-session response without revealing token state details.",
      "verification_type": "CONTRACT_CHECK",
      "verification_detail": "Assert status code and response schema against the approved contract.",
      "requirement_ids": [
        "REQ-AUTH-017"
      ],
      "mandatory": true,
      "evidence_expected": "response fixture"
    }
  ],
  "verification_plan": [
    "Run token rotation unit tests",
    "Run authentication integration tests",
    "Inspect audit event emitted for reuse detection"
  ],
  "verification_steps": [
    {
      "step_id": "V1",
      "verification_type": "TEST",
      "description": "Run auth integration tests",
      "command": "npm test -- auth",
      "expected_result": "pass",
      "environment": "ci",
      "deterministic": true,
      "human_review_required": false
    }
  ],
  "definition_of_ready": [
    "Token-family contract is approved",
    "Persistence interface is available",
    "Expected error response is defined"
  ],
  "definition_of_done": [
    "Acceptance criteria pass",
    "No unrelated authentication behavior changes",
    "Security-relevant event is observable"
  ],
  "assumptions": [],
  "open_questions": [],
  "capability_tags": [
    "backend",
    "authentication",
    "security",
    "state-machine",
    "integration-testing"
  ],
  "suggested_agent_role": "security-engineer",
  "tools_required": [
    "repository-read",
    "repository-write",
    "test-runner"
  ],
  "tool_restrictions": [],
  "context_refs": [
    "REQ-AUTH-017",
    "REQ-SEC-004",
    "CMP-AUTH-API",
    "CMP-TOKEN-STORE"
  ],
  "estimated_context_size": "MEDIUM",
  "parallelization": {
    "parallelizable": false,
    "execution_wave": null,
    "conflict_keys": [
      "auth-token-contract",
      "token-family-schema"
    ],
    "integration_surface": [
      "authentication API",
      "token persistence"
    ]
  },
  "security_sensitivity": "CRITICAL",
  "approval_requirements": [],
  "created_at": null,
  "updated_at": null
}
